[
  {
    "sourceId": "src-kz-bybit-001",
    "exchangeId": "bybit",
    "countryCode": "KZ",
    "productScope": [
      "entity",
      "regulation"
    ],
    "url": "https://publicreg.myafsa.com/licence_details/AFSA-A-LA-2024-0027/",
    "sourceTier": "A",
    "publisher": "Astana Financial Services Authority",
    "title": "AFSA Public Register — Bybit Limited licence entry",
    "publishedDate": null,
    "updatedDate": null,
    "retrievedDate": "2026-07-21",
    "effectiveFrom": "2024-09-25",
    "effectiveTo": null,
    "language": "en",
    "contentHash": "3a9e9191f5309f0f8bedd8945a90b8546b960f2bbff29f84af2e39a9219686be",
    "captureType": "HTML",
    "status": "ACTIVE"
  },
  {
    "sourceId": "src-kz-bybit-002",
    "exchangeId": "bybit",
    "countryCode": "KZ",
    "productScope": [],
    "url": "https://afsa.aifc.kz/regulated-activities/operating-a-digital-asset-trading-facility/",
    "sourceTier": "A",
    "publisher": "Astana Financial Services Authority",
    "title": "AFSA guidance — Operating a Digital Asset Trading Facility",
    "publishedDate": null,
    "updatedDate": null,
    "retrievedDate": "2026-07-21",
    "effectiveFrom": null,
    "effectiveTo": null,
    "language": "en",
    "contentHash": "ae2adff0d88dbad6cb66d7f7983458edc9f0484f4f8535be91831a6e97d5b52f",
    "captureType": "HTML",
    "status": "ACTIVE"
  },
  {
    "sourceId": "src-kz-bybit-003",
    "exchangeId": "bybit",
    "countryCode": "KZ",
    "productScope": [
      "regulation"
    ],
    "url": "https://afsa.aifc.kz/afsa-launches-pilot-project-to-accept-regulatory-fees-in-stablecoins/",
    "sourceTier": "A",
    "publisher": "Astana Financial Services Authority",
    "title": "AFSA launches pilot project to accept regulatory fees in stablecoins",
    "publishedDate": null,
    "updatedDate": null,
    "retrievedDate": "2026-07-21",
    "effectiveFrom": null,
    "effectiveTo": null,
    "language": "en",
    "contentHash": "5ba21acabebc84c67a839f378334c6329c8b2653e53ddce86b31996afa4f9e6b",
    "captureType": "HTML",
    "status": "ACTIVE"
  },
  {
    "sourceId": "src-kz-bybit-004",
    "exchangeId": "bybit",
    "countryCode": "KZ",
    "productScope": [
      "regulation"
    ],
    "url": "https://aifc.kz/news/afsa-alerts-to-forged-licence-used-by-individual-presenting-himself-as-nurlan-asilbekov-whose-true-identity-remains-unknown/",
    "sourceTier": "A",
    "publisher": "Astana International Financial Centre / AFSA",
    "title": "AFSA alert on forged Bybit licence used by impersonator",
    "publishedDate": "2025-04-17",
    "updatedDate": null,
    "retrievedDate": "2026-07-21",
    "effectiveFrom": null,
    "effectiveTo": null,
    "language": "en",
    "contentHash": "44d33b27a7a689177715c95fdb0dfd6a37a8688000d8efe5ff8c1d4a9814a98a",
    "captureType": "HTML",
    "status": "ACTIVE"
  },
  {
    "sourceId": "src-kz-bybit-005",
    "exchangeId": "bybit",
    "countryCode": "KZ",
    "productScope": [
      "entity"
    ],
    "url": "https://www.bybit.kz/en-KAZ/help-center/article/Bybit-KZ-Privacy-Policy",
    "sourceTier": "A",
    "publisher": "Bybit Kazakhstan",
    "title": "Bybit Kazakhstan Privacy Policy",
    "publishedDate": "2025-06-06",
    "updatedDate": null,
    "retrievedDate": "2026-07-21",
    "effectiveFrom": "2024-12-24",
    "effectiveTo": null,
    "language": "en",
    "contentHash": "6f70cebea845970a5c6c7f59d7c84e395bb78bd8d4807cc1e1cacd57f2be89ff",
    "captureType": "HTML",
    "status": "ACTIVE"
  },
  {
    "sourceId": "src-kz-bybit-006",
    "exchangeId": "bybit",
    "countryCode": "KZ",
    "productScope": [
      "entity"
    ],
    "url": "https://www.bybit.kz/en-KAZ/help-center/article/Bybit-KZ-Risk-Disclosure",
    "sourceTier": "A",
    "publisher": "Bybit Kazakhstan",
    "title": "Bybit Kazakhstan Risk Disclosure Statement",
    "publishedDate": "2025-06-06",
    "updatedDate": null,
    "retrievedDate": "2026-07-21",
    "effectiveFrom": "2024-12-24",
    "effectiveTo": null,
    "language": "en",
    "contentHash": "3b2e4b62673e6082ab97e893ea8bb17d95e59df7f1c406929480830fede46d11",
    "captureType": "HTML",
    "status": "ACTIVE"
  },
  {
    "sourceId": "src-kz-bybit-007",
    "exchangeId": "bybit",
    "countryCode": "KZ",
    "productScope": [
      "entity",
      "restrictions"
    ],
    "url": "https://www.bybit.kz/en-KAZ/help-center/article/Service-Restricted-Countries",
    "sourceTier": "A",
    "publisher": "Bybit Kazakhstan",
    "title": "Bybit Kazakhstan — Service Restricted Countries",
    "publishedDate": "2026-05-07",
    "updatedDate": null,
    "retrievedDate": "2026-07-21",
    "effectiveFrom": null,
    "effectiveTo": null,
    "language": "en",
    "contentHash": "662cc1fb3948dbd9cd2a89d48e88eeb6e1a2f3c318137c3ebee7eed4c053f595",
    "captureType": "HTML",
    "status": "ACTIVE"
  },
  {
    "sourceId": "src-kz-bybit-008",
    "exchangeId": "bybit",
    "countryCode": "KZ",
    "productScope": [
      "restrictions"
    ],
    "url": "https://www.bybit.com/en/help-center/article/Service-Restricted-Countries/",
    "sourceTier": "A",
    "publisher": "Bybit",
    "title": "Global Bybit — Service Restricted Countries",
    "publishedDate": null,
    "updatedDate": null,
    "retrievedDate": "2026-07-21",
    "effectiveFrom": null,
    "effectiveTo": null,
    "language": "en",
    "contentHash": "367d39019779eac319094d900aee0b7d54a340b3e5ec27200948ea02ea299dac",
    "captureType": "HTML",
    "status": "ACTIVE"
  },
  {
    "sourceId": "src-kz-bybit-009",
    "exchangeId": "bybit",
    "countryCode": "KZ",
    "productScope": [
      "applications",
      "earn",
      "other_products",
      "spot"
    ],
    "url": "https://www.bybit.kz/en-KAZ/help-center/article/Everything-You-Need-to-Know-to-Get-Started-on-Bybit",
    "sourceTier": "B",
    "publisher": "Bybit Kazakhstan",
    "title": "Everything You Need to Know to Get Started on Bybit Kazakhstan",
    "publishedDate": "2025-12-18",
    "updatedDate": null,
    "retrievedDate": "2026-07-21",
    "effectiveFrom": null,
    "effectiveTo": null,
    "language": "en",
    "contentHash": "0dfd9f80815da70d03e52036333ff22585f4d7405e6a96fd98acac977cd9c6bf",
    "captureType": "HTML",
    "status": "ACTIVE"
  },
  {
    "sourceId": "src-kz-bybit-010",
    "exchangeId": "bybit",
    "countryCode": "KZ",
    "productScope": [
      "entity",
      "registration"
    ],
    "url": "https://www.bybit.kz/en-KAZ/help-center/article/How-to-register-an-account",
    "sourceTier": "B",
    "publisher": "Bybit Kazakhstan",
    "title": "How to Register an Account",
    "publishedDate": "2025-11-25",
    "updatedDate": null,
    "retrievedDate": "2026-07-21",
    "effectiveFrom": null,
    "effectiveTo": null,
    "language": "en",
    "contentHash": "1ea6ada9f10ed2e93f1a38dd2e1945c9a2d6ec92a7cc57d541a35f39ce6e8460",
    "captureType": "HTML",
    "status": "ACTIVE"
  },
  {
    "sourceId": "src-kz-bybit-011",
    "exchangeId": "bybit",
    "countryCode": "KZ",
    "productScope": [
      "promotions",
      "referral",
      "registration"
    ],
    "url": "https://www.bybit.kz/en-KAZ/help-center/article/FAQ-Account-Settings",
    "sourceTier": "B",
    "publisher": "Bybit Kazakhstan",
    "title": "FAQ — Account Settings",
    "publishedDate": "2025-11-25",
    "updatedDate": null,
    "retrievedDate": "2026-07-21",
    "effectiveFrom": null,
    "effectiveTo": null,
    "language": "en",
    "contentHash": "9c8387eb6bfe4bf9805b0de297adfe5e0dafcb925ba8f6262a180069ce09f9f1",
    "captureType": "HTML",
    "status": "ACTIVE"
  },
  {
    "sourceId": "src-kz-bybit-012",
    "exchangeId": "bybit",
    "countryCode": "KZ",
    "productScope": [
      "kyc",
      "language_support"
    ],
    "url": "https://www.bybit.kz/en-KAZ/help-center/article/Individual-KYC-FAQ",
    "sourceTier": "B",
    "publisher": "Bybit Kazakhstan",
    "title": "FAQ — Individual KYC",
    "publishedDate": "2025-11-25",
    "updatedDate": null,
    "retrievedDate": "2026-07-21",
    "effectiveFrom": null,
    "effectiveTo": null,
    "language": "en",
    "contentHash": "c53a15ff77fe46e76434c7303cc590e8a7aafe8fce975d11d5f6f32af3837fa2",
    "captureType": "HTML",
    "status": "ACTIVE"
  },
  {
    "sourceId": "src-kz-bybit-013",
    "exchangeId": "bybit",
    "countryCode": "KZ",
    "productScope": [],
    "url": "https://www.bybit.kz/en-KAZ/help-center/article/How-to-Complete-Individual-KYC-Verification",
    "sourceTier": "B",
    "publisher": "Bybit Kazakhstan",
    "title": "How to Complete Individual KYC Verification",
    "publishedDate": null,
    "updatedDate": null,
    "retrievedDate": "2026-07-21",
    "effectiveFrom": null,
    "effectiveTo": null,
    "language": "en",
    "contentHash": "8fd430f3c52e4894447d9cb5b59da9e2f39895c799936fbcd5c71a45a0830769",
    "captureType": "HTML",
    "status": "ACTIVE"
  },
  {
    "sourceId": "src-kz-bybit-014",
    "exchangeId": "bybit",
    "countryCode": "KZ",
    "productScope": [
      "kyc",
      "language_support"
    ],
    "url": "https://www.bybit.kz/en-KAZ/help-center/article/Business-KYC-FAQ",
    "sourceTier": "B",
    "publisher": "Bybit Kazakhstan",
    "title": "FAQ — Business KYC",
    "publishedDate": "2025-11-25",
    "updatedDate": null,
    "retrievedDate": "2026-07-21",
    "effectiveFrom": null,
    "effectiveTo": null,
    "language": "en",
    "contentHash": "b06a1f2f9160c0e492f874f7616e947df1af03a646ba334b8283fe9ccd91dfef",
    "captureType": "HTML",
    "status": "ACTIVE"
  },
  {
    "sourceId": "src-kz-bybit-015",
    "exchangeId": "bybit",
    "countryCode": "KZ",
    "productScope": [],
    "url": "https://www.bybit.kz/en-KAZ/help-center/article/Common-Reasons-and-Solutions-for-KYC-Verification-Failures",
    "sourceTier": "B",
    "publisher": "Bybit Kazakhstan",
    "title": "Common Reasons and Solutions for KYC Verification Failures",
    "publishedDate": "2025-11-25",
    "updatedDate": null,
    "retrievedDate": "2026-07-21",